{
  "status": "PASS",
  "generated_at": "2026-03-01T00:44:29.370154+00:00",
  "batch_id": "BATCH-20260301-36",
  "reviewer_expected": "codex-manual",
  "snapshot_path": "/Users/niigatadaigakukenkyuuyou/Desktop/開発アプリ/kikidoko/frontend/dist/equipment_snapshot.json.gz",
  "queue_path": "/Users/niigatadaigakukenkyuuyou/Desktop/開発アプリ/kikidoko/tools/manual_curation_queue_batch36.jsonl",
  "checkpoint_path": "/Users/niigatadaigakukenkyuuyou/Desktop/開発アプリ/kikidoko/tools/manual_curation_checkpoint_batch36.json",
  "session_path": "/Users/niigatadaigakukenkyuuyou/Desktop/開発アプリ/kikidoko/tools/manual_guard_session_BATCH-20260301-36.json",
  "inspected_count": 100,
  "target_count": 100,
  "metrics": {
    "summary_dup_rate": 0.0,
    "principle_dup_rate": 0.0,
    "step1_dup_rate": 0.0,
    "pitfall1_dup_rate": 0.0,
    "step2_same_ratio": 0.01,
    "pitfall2_same_ratio": 0.01,
    "reviewed_at_unique_count": 100,
    "forbidden_pattern_hits": 0
  },
  "threshold_failures": [],
  "issue_counts": {},
  "issues": [],
  "checkpoint_snapshot": {
    "updated_at": "2026-03-01T00:44:07.382313+00:00",
    "defaults_added": 0,
    "processed_rows_this_run": 10,
    "applied_rows_this_run": 10,
    "needs_manual_fix_this_run": 0,
    "done": 100,
    "remaining": 0,
    "batch_size": 10,
    "process_all": false,
    "reviewer_default": "codex-manual",
    "snapshot_path": "/Users/niigatadaigakukenkyuuyou/Desktop/開発アプリ/kikidoko/frontend/dist/equipment_snapshot.json.gz",
    "queue_path": "/Users/niigatadaigakukenkyuuyou/Desktop/開発アプリ/kikidoko/tools/manual_curation_queue_batch36.jsonl",
    "attestation_path": "/Users/niigatadaigakukenkyuuyou/Desktop/開発アプリ/kikidoko/tools/manual_guard_session_BATCH-20260301-36.json",
    "guard_verify": {
      "status": "PASS",
      "session": "/Users/niigatadaigakukenkyuuyou/Desktop/開発アプリ/kikidoko/tools/manual_guard_session_BATCH-20260301-36.json",
      "batch_id": "BATCH-20260301-36",
      "reviewer_expected": "codex-manual",
      "issues": [],
      "details": {
        "agents_sha256_current": "5013a875aebd75d9486db350e19355a5ff658ad20078a8da0d4c30a81f2172a0",
        "queue_sha256_current": "19a323f8aa37437f64229744a72bff7e8882e249b0bae83e74660d4f9c5ab58b",
        "snapshot_sha256_current": "5408a6413e8b8eb4079fdc606fe3a0e01ef10e60b9c4d57450f1686d2e133ff8",
        "queue_rows_current": 10,
        "queue_rows_target": 100
      },
      "verified_at": "2026-03-01T00:44:05.303229+00:00"
    },
    "post_audit_report_path": "/Users/niigatadaigakukenkyuuyou/Desktop/開発アプリ/kikidoko/tools/manual_authenticity_audit_report_batch36.json",
    "post_audit_status": "PASS",
    "post_audit": {
      "status": "PASS",
      "generated_at": "2026-03-01T00:44:08.017921+00:00",
      "batch_id": "BATCH-20260301-36",
      "reviewer_expected": "codex-manual",
      "snapshot_path": "/Users/niigatadaigakukenkyuuyou/Desktop/開発アプリ/kikidoko/frontend/dist/equipment_snapshot.json.gz",
      "queue_path": "/Users/niigatadaigakukenkyuuyou/Desktop/開発アプリ/kikidoko/tools/manual_curation_queue_batch36.jsonl",
      "checkpoint_path": "/Users/niigatadaigakukenkyuuyou/Desktop/開発アプリ/kikidoko/tools/manual_curation_checkpoint_batch36.json",
      "session_path": "/Users/niigatadaigakukenkyuuyou/Desktop/開発アプリ/kikidoko/tools/manual_guard_session_BATCH-20260301-36.json",
      "inspected_count": 100,
      "target_count": 100,
      "metrics": {
        "summary_dup_rate": 0.0,
        "principle_dup_rate": 0.0,
        "step1_dup_rate": 0.0,
        "pitfall1_dup_rate": 0.0,
        "step2_same_ratio": 0.01,
        "pitfall2_same_ratio": 0.01,
        "reviewed_at_unique_count": 100,
        "forbidden_pattern_hits": 0
      },
      "threshold_failures": [],
      "issue_counts": {},
      "issues": [],
      "checkpoint_snapshot": {
        "updated_at": "2026-03-01T00:44:07.382313+00:00",
        "defaults_added": 0,
        "processed_rows_this_run": 10,
        "applied_rows_this_run": 10,
        "needs_manual_fix_this_run": 0,
        "done": 100,
        "remaining": 0,
        "batch_size": 10,
        "process_all": false,
        "reviewer_default": "codex-manual",
        "snapshot_path": "/Users/niigatadaigakukenkyuuyou/Desktop/開発アプリ/kikidoko/frontend/dist/equipment_snapshot.json.gz",
        "queue_path": "/Users/niigatadaigakukenkyuuyou/Desktop/開発アプリ/kikidoko/tools/manual_curation_queue_batch36.jsonl",
        "attestation_path": "/Users/niigatadaigakukenkyuuyou/Desktop/開発アプリ/kikidoko/tools/manual_guard_session_BATCH-20260301-36.json",
        "guard_verify": {
          "status": "PASS",
          "session": "/Users/niigatadaigakukenkyuuyou/Desktop/開発アプリ/kikidoko/tools/manual_guard_session_BATCH-20260301-36.json",
          "batch_id": "BATCH-20260301-36",
          "reviewer_expected": "codex-manual",
          "issues": [],
          "details": {
            "agents_sha256_current": "5013a875aebd75d9486db350e19355a5ff658ad20078a8da0d4c30a81f2172a0",
            "queue_sha256_current": "19a323f8aa37437f64229744a72bff7e8882e249b0bae83e74660d4f9c5ab58b",
            "snapshot_sha256_current": "5408a6413e8b8eb4079fdc606fe3a0e01ef10e60b9c4d57450f1686d2e133ff8",
            "queue_rows_current": 10,
            "queue_rows_target": 100
          },
          "verified_at": "2026-03-01T00:44:05.303229+00:00"
        },
        "post_audit_report_path": "/Users/niigatadaigakukenkyuuyou/Desktop/開発アプリ/kikidoko/tools/manual_authenticity_audit_report_batch36.json",
        "post_audit_status": "PENDING_FINAL_BATCH"
      }
    }
  }
}